{
  "schema_id": "handbook.internal-dispatch",
  "schema_version": "1.0",
  "dispatch_id": "20260714T132155Z--HCM-0-8--independent-orchestration-repair-review",
  "created_at_utc": "2026-07-14T13:21:55Z",
  "source_handoff_ids": [
    "20260714T020014Z--HCM-0-1--review--clean-closure"
  ],
  "parent_orchestration_id": "20260714T132155Z--HCM-0-8--orchestration",
  "orchestration_decision": "cross_document_repair",
  "execution_target": "internal_subagent",
  "agent_type": "default",
  "role": "review",
  "fresh_context_required": true,
  "closeout_owner": "parent_orchestrator",
  "required_skills": [
    "using-agent-skills",
    "code-review-and-quality"
  ],
  "phase_id": "HCM-0",
  "slice_id": "HCM-0.8",
  "packet_id": null,
  "subject_fingerprint": "sha256:e3855c17299f7154462fc55d4b1be0df36216e36668a1ff5aab2959f14f2a802",
  "active_resolution": {
    "level": "coordination",
    "scope_horizon": "slice",
    "detail_resolution": "high",
    "temporal_horizon": "current_orchestration",
    "authority_horizon": "control_pack",
    "memory_horizon": "program_transition",
    "validation_horizon": "slice_closeout"
  },
  "authority_refs": [
    {
      "path": "docs/specs/handbook-contract-membrane/00-README.md",
      "sections": [
        "Authority stack",
        "Top-level orchestration and closeout rule",
        "Orchestration loop"
      ]
    },
    {
      "path": "docs/specs/handbook-contract-membrane/04-phase-slice-map.md",
      "sections": [
        "Top-level slice-runner rule",
        "Phase 0 — Architecture and contract freeze",
        "Finding-driven decomposition protocol"
      ]
    },
    {
      "path": "docs/specs/handbook-contract-membrane/05-contracts-schemas-and-gates.md",
      "sections": [
        "Development orchestration contracts"
      ]
    },
    {
      "path": "docs/specs/handbook-contract-membrane/06-proof-and-regression-ledger.md",
      "sections": [
        "Open program proof gates",
        "Regression rules",
        "Control-pack orchestration-repair proof gate"
      ]
    },
    {
      "path": "docs/specs/handbook-contract-membrane/07-orchestration-onboarding-prompt.md",
      "sections": [
        "Entire document"
      ]
    },
    {
      "path": "docs/specs/handbook-contract-membrane/08-handoff-ledger-and-escalation-protocol.md",
      "sections": [
        "Entire document"
      ]
    }
  ],
  "repo_truth": "The 40-path pre-dispatch subject contains the complete accumulated HCM control-pack work plus the HCM-0.8 correction. The immutable HCM-0.1 history demonstrates a user-routed review/remediation queue. The active contract now intends one parent-owned slice loop, internal built-in default subagents, JSON dispatches, v1.2 true-stop handoffs, and two-commit closeout. No Rust files are in scope.",
  "allowed_scope": [
    "Read the complete 40-path subject identified by subject_fingerprint.",
    "Run read-only schema, validator, link, consistency, archive, portability, and docs-only checks.",
    "Report findings only; do not edit, commit, write a handoff, append the ledger, or create another dispatch."
  ],
  "non_goals": [
    "No implementation or Rust changes.",
    "No changes to immutable v1.0/v1.1 records or legacy Markdown dispatches.",
    "No review of future Handbook runtime implementation.",
    "No user-mediated follow-up dispatch.",
    "No global handoff or ledger write by the reviewer."
  ],
  "tasks": [
    "Independently verify that 00 through 08 define one long-lived explicit phase/slice parent rather than a next-session queue.",
    "Verify internal dispatch ownership, required skills, built-in default/fresh agent constraints, result collection, review-remediation-different-fresh-review lineage, and genuine stop conditions.",
    "Verify v1.2 and internal-dispatch schemas/templates/validator enforce the documented contract without rewriting historical schemas or artifacts.",
    "Verify HCM-0.8 preserves the truthful HCM-0.1 history and does not retroactively claim the new workflow was previously proven.",
    "Run the named validation wall and return findings first with severity, file/line, violated contract/gate, smallest remediation, and missing proof."
  ],
  "contracts_and_gates": [
    "05 Development orchestration contracts",
    "06 PG-HANDOFF-01",
    "06 PG-HANDOFF-02",
    "06 PG-ORCH-01",
    "06 PG-ORCH-02",
    "06 control-pack orchestration-repair proof gate",
    "06 regression rules 18 through 21"
  ],
  "stop_conditions": [
    "Return blocked to the parent if required files cannot be read or validation infrastructure is unavailable.",
    "Do not widen into runtime implementation or edit any file.",
    "Do not create a handoff or ledger entry."
  ],
  "return_contract": {
    "transport": "built_in_subagent",
    "findings_first": true,
    "include_agent_identity_and_status": true,
    "edit_scope": "read_only",
    "global_handoff": "forbidden",
    "ledger_write": "forbidden",
    "user_task_hop": "forbidden",
    "required_result_fields": [
      "agent_id",
      "final_status",
      "verdict",
      "findings",
      "validation",
      "parent_disposition"
    ]
  }
}
